code,title,prereq,terms,hours,optional,description,instructor,section_head,offered_to
6.7710,Discrete Stochastic Processes,6.3702 or 18.204,Acad Year 2024-2025: G (Spring) Acad Year 2025-2026: Not offered,4-0-8 units,,"Review of probability and laws of large numbers; Poisson counting process and renewal processes; Markov chains (including Markov decision theory), branching processes, birth-death processes, and semi-Markov processes; continuous-time Markov chains and reversibility; random walks, martingales, and large deviations; applications from queueing, communication, control, and operations research.","R. G. Gallager, V. W. S. Chan",Probability & Statistics,G
6.7720[J],Discrete Probability and Stochastic Processes,"6.3702 , 6.7700[J] , 18.100A , 18.100B , or 18.100Q",G (Spring),3-0-9 units,,See description under subject 15.070[J] .,"G. Bresler, D. Gamarnik, E. Mossel, Y. Polyanskiy",Probability & Statistics,G
6.3800,Introduction to Inference,Calculus II (GIR) or permission of instructor,U (Fall),4-4-4 units. Institute LAB,,"Introduces probabilistic modeling for problems of inference and machine learning from data, emphasizing analytical and computational aspects. Distributions, marginalization, conditioning, and structure, including graphical and neural network representations. Belief propagation, decision-making, classification, estimation, and prediction. Sampling methods and analysis. Introduces asymptotic analysis and information measures. Computational laboratory component explores the concepts introduced in class in the context of contemporary applications. Students design inference algorithms, investigate their behavior on real data, and discuss experimental results.","P. Golland, G. W. Wornell",Inference,U
6.7800,Inference and Information,"6.3700 , 6.3800 , or 6.7700[J]",G (Spring),4-0-8 units,,"Introduction to principles of Bayesian and non-Bayesian statistical inference. Hypothesis testing and parameter estimation, sufficient statistics; exponential families. EM agorithm. Log-loss inference criterion, entropy and model capacity. Kullback-Leibler distance and information geometry. Asymptotic analysis and large deviations theory. Model order estimation; nonparametric statistics. Computational issues and approximation techniques; Monte Carlo methods. Selected topics such as universal inference and learning, and universal features and neural networks.","P. Golland, G. W. Wornell",Inference,G
6.7810,Algorithms for Inference,"18.06 and ( 6.3700 , 6.3800 , or 6.7700[J] )",G (Fall),4-0-8 units,,"Introduction to computational aspects of statistical inference via probabilistic graphical models. Directed and undirected graphical models, and factor graphs, over discrete and Gaussian distributions; hidden Markov models, linear dynamical systems. Sum-product and junction tree algorithms; forward-backward algorithm, Kalman filtering and smoothing. Min-sum and Viterbi algorithms. Variational methods, mean-field theory, and loopy belief propagation. Sampling methods; Glauber dynamics and mixing time analysis. Parameter structure learning for graphical models; Baum-Welch and Chow-Liu algorithms. Selected topics such as causal inference, particle filtering, restricted Boltzmann machines, and graph neural networks.","G. Bresler, D. Shah, G. W. Wornell",Inference,G
6.7820[J],"Graphical Models: A Geometric, Algebraic, and Combinatorial Perspective",6.3702 and 18.06,G (Fall) Not offered regularly; consult department,3-0-9 units,,See description under subject IDS.136[J] .,C. Uhler,Inference,G
6.7830,Bayesian Modeling and Inference,6.7700[J] and 6.7900,G (Spring),3-0-9 units,,"Covers Bayesian modeling and inference at an advanced graduate level. Topics include de Finetti's theorem, decision theory, approximate inference (modern approaches and analysis of Monte Carlo, variational inference, etc.), hierarchical modeling, (continuous and discrete) nonparametric Bayesian approaches, sensitivity and robustness, and evaluation.",T. Broderick,Inference,G
6.3900,Introduction to Machine Learning,"( 6.1010 or 6.1210 ) and ( 18.03 , 18.06 , 18.700 , or 18.C06[J] )","U (Fall, Spring)",4-0-8 units,,"Introduction to the principles and algorithms of machine learning from an optimization perspective. Topics include linear and non-linear models for supervised, unsupervised, and reinforcement learning, with a focus on gradient-based methods and neural-network architectures. Previous experience with algorithms may be helpful.","V. Monardo, S. Shen",Machine Learning,U
6.3950,"AI, Decision Making, and Society","None. Coreq: 6.1200[J] , 6.3700 , 6.3800 , 18.05 , or 18.600",U (Fall),4-0-8 units,,"Introduction to fundamentals of modern data-driven decision-making frameworks, such as causal inference and hypothesis testing in statistics as well as supervised and reinforcement learning in machine learning. Explores how these frameworks are being applied in various societal contexts, including criminal justice, healthcare, finance, and social media. Emphasis on pinpointing the non-obvious interactions, undesirable feedback loops, and unintended consequences that arise in such settings. Enables students to develop their own principled perspective on the interface of data-driven decision making and society. Students taking graduate version complete additional assignments.","A. Ozdaglar, A. Madry, A. Wilson",Machine Learning,U
6.3952,"AI, Decision Making, and Society","None. Coreq: 6.1200[J] , 6.3700 , 6.3800 , or 18.05",G (Fall),4-0-8 units,,"Introduction to fundamentals of modern data-driven decision-making frameworks, such as causal inference and hypothesis testing in statistics as well as supervised and reinforcement learning in machine learning. Explores how these frameworks are being applied in various societal contexts, including criminal justice, healthcare, finance, and social media. Emphasis on pinpointing the non-obvious interactions, undesirable feedback loops, and unintended consequences that arise in such settings. Enables students to develop their own principled perspective on the interface of data-driven decision making and society. Students taking graduate version complete additional assignments.","A. Ozdaglar, A. Madry, A. Wilson",Machine Learning,G
6.7900,Machine Learning,"18.06 and ( 6.3700 , 6.3800 , or 18.600 )",G (Fall),3-0-9 units,,"Principles, techniques, and algorithms in machine learning from the point of view of statistical inference; representation, generalization, and model selection; and methods such as linear/additive models, active learning, boosting, support vector machines, non-parametric Bayesian methods, hidden Markov models, Bayesian networks, and convolutional and recurrent neural networks. Recommended prerequisite: 6.3900 or other previous experience in machine learning. Enrollment may be limited.","C. Daskalakis, T. Jaakkola",Machine Learning,G
6.7910[J],Statistical Learning Theory and Applications,"6.3700 , 6.7900 , 18.06 , or permission of instructor",G (Fall),3-0-9 units,,See description under subject 9.520[J] .,"T. Poggio, L. Rosasco",Machine Learning,G
6.7920[J],Reinforcement Learning: Foundations and Methods,6.3700 or permission of instructor,G (Fall),4-0-8 units,,"Examines reinforcement learning (RL) as a methodology for approximately solving sequential decision-making under uncertainty, with foundations in optimal control and machine learning. Provides a mathematical introduction to RL, including dynamic programming, statistical, and empirical perspectives, and special topics. Core topics include: dynamic programming, special structures, finite and infinite horizon Markov Decision Processes, value and policy iteration, Monte Carlo methods, temporal differences, Q-learning, stochastic approximation, and bandits. Also covers approximate dynamic programming, including value-based methods and policy space methods. Applications and examples drawn from diverse domains. Focus is mathematical, but is supplemented with computational exercises. An analysis prerequisite is suggested but not required; mathematical maturity is necessary.","C. Wu, M. Dahleh",Machine Learning,G
6.7930[J],Machine Learning for Healthcare,"6.3900 , 6.4100 , 6.7810 , 6.7900 , 6.8611 , or 9.520[J]",G (Spring),4-0-8 units,,"Introduces students to machine learning in healthcare, including the nature of clinical data and the use of machine learning for risk stratification, disease progression modeling, precision medicine, diagnosis, subtype discovery, and improving clinical workflows. Topics include causality, interpretability, algorithmic fairness, time-series analysis, graphical models, deep learning and transfer learning. Guest lectures by clinicians from the Boston area, and projects with real clinical data, emphasize subtleties of working with clinical data and translating machine learning into clinical practice. Limited to 55.","D. Sontag, P. Szolovits",Machine Learning,G
6.7940,Dynamic Programming and Reinforcement Learning,6.3700 or 18.600,G (Spring) Not offered regularly; consult department,4-0-8 units,,"Dynamic programming as a unifying framework for sequential decision-making under uncertainty, Markov decision problems, and stochastic control. Perfect and imperfect state information models. Finite horizon and infinite horizon problems, including discounted and average cost formulations. Value and policy iteration. Suboptimal methods. Approximate dynamic programming for large-scale problems, and reinforcement learning. Applications and examples drawn from diverse domains. While an analysis prerequisite is not required, mathematical maturity is necessary.",J. N. Tsitsiklis,Machine Learning,G
6.7950,Advanced Topics in Control,Permission of instructor,G (Fall) Not offered regularly; consult department,3-0-9 units,Can be repeated for credit.,Advanced study of topics in control. Specific focus varies from year to year.,Consult Department,Machine Learning,G
6.7960,Deep Learning (New),"18.05 and ( 6.3720 , 6.3900 , or 6.C01 )",G (Fall),3-0-9 units,,"Fundamentals of deep learning, including both theory and applications. Topics include neural net architectures (MLPs, CNNs, RNNs, graph nets, transformers), geometry and invariances in deep learning, backpropagation and automatic differentiation, learning theory and generalization in high-dimensions, and applications to computer vision, natural language processing, and robotics.","P. Isola, S. Jegelka, S. Beery",Machine Learning,G
6.4100,Artificial Intelligence,6.100A,U (Fall) Not offered regularly; consult department,4-3-5 units,,"Introduces representations, methods, and architectures used to build applications and to account for human intelligence from a computational point of view. Covers applications of rule chaining, constraint propagation, constrained search, inheritance, statistical inference, and other problem-solving paradigms. Also addresses applications of identification trees, neural nets, genetic algorithms, support-vector machines, boosting, and other learning paradigms. Considers what separates human intelligence from that of other animals.",Staff,Artificial Intelligence,U
6.4102,Artificial Intelligence,6.100A,G (Fall) Not offered regularly; consult department,4-3-5 units,,"Introduces representations, methods, and architectures used to build applications and to account for human intelligence from a computational point of view. Covers applications of rule chaining, constraint propagation, constrained search, inheritance, statistical inference, and other problem-solving paradigms. Also addresses applications of identification trees, neural nets, genetic algorithms, support-vector machines, boosting, and other learning paradigms. Considers what separates human intelligence from that of other animals. Students taking  graduate version complete additional assignments.",K. Koile,Artificial Intelligence,G
6.4110,"Representation, Inference, and Reasoning in AI","( 16.09 and 16.410[J] ) or ( 6.1010 , 6.1210 , and ( 6.3700 or 6.3800 ))",U (Spring),3-0-9 units,,"An introduction to representations and algorithms for artificial intelligence. Topics covered include: constraint satisfaction in discrete and continuous problems, logical representation and inference, Monte Carlo tree search, probabilistic graphical models and inference, planning in discrete and continuous deterministic and probabilistic models including MDPs and POMDPs.","L. P. Kaelbling, T. Lozano-Perez, N. Roy",Artificial Intelligence,U
6.4120[J],Computational Cognitive Science,"6.3700 , 6.3800 , 9.40 , 18.05 , 6.3900 , or permission of instructor",U (Fall),3-0-9 units,,See description under subject 9.66[J] .,J. Tenenbaum,Artificial Intelligence,U
6.4130[J],Principles of Autonomy and Decision Making,"6.100B , 6.1010 , 6.9080 , or permission of instructor",U (Fall),4-0-8 units,,See description under subject 16.410[J] .,B. C. Williams,Artificial Intelligence,U
6.4132[J],Principles of Autonomy and Decision Making,"6.100B , 6.9080 , or permission of instructor",G (Fall),3-0-9 units,,See description under subject 16.413[J] .,B. C. Williams,Artificial Intelligence,G
6.4150[J],Artificial Intelligence for Business,,Acad Year 2024-2025: Not offered Acad Year 2025-2026: G (Spring),3-0-6 units,,See description under subject 15.563[J] .,M.  Raghavan,Artificial Intelligence,G
6.8110[J],Cognitive Robotics,"( 6.4100 or 16.413[J] ) and ( 6.1200[J] , 6.3700 , or 16.09 )",G (Spring),3-0-9 units,,See description under subject 16.412[J] . Enrollment may be limited.,B. C. Williams,Artificial Intelligence,G
6.4200[J],Robotics: Science and Systems,"(( 1.00 or 6.100A ) and ( 2.003[J] , 6.1010 , 6.1210 , or 16.06 )) or permission of instructor",U (Spring),2-6-4 units. Institute LAB,,"Presents concepts, principles, and algorithmic foundations for robots and autonomous vehicles operating in the physical world. Topics include sensing, kinematics and dynamics, state estimation, computer vision, perception, learning, control, motion planning, and embedded system development. Students design and implement advanced algorithms on complex robotic platforms capable of agile autonomous navigation and real-time interaction with the physical word. Students engage in extensive written and oral communication exercises. Enrollment limited.","L. Carlone, S. Karaman, D. Hadfield-Manell, J. Leonard",Robotics,U
6.4210,Robotic Manipulation,( 6.100A and 6.3900 ) or permission of instructor,U (Fall),4-2-9 units,,"Introduces the fundamental algorithmic approaches for creating robot systems that can autonomously manipulate physical objects in unstructured environments such as homes and restaurants. Topics include perception (including approaches based on deep learning and approaches based on 3D geometry), planning (robot kinematics and trajectory generation, collision-free motion planning, task-and-motion planning, and planning under uncertainty), as well as dynamics and control (both model-based and learning-based). Students taking graduate version complete additional assignments. Students engage in extensive written and oral communication exercises.",R. Tedrake,Robotics,U
6.4212,Robotic Manipulation,( 6.100A and 6.3900 ) or permission of instructor,G (Fall),3-0-9 units,,"Introduces the fundamental algorithmic approaches for creating robot systems that can autonomously manipulate physical objects in unstructured environments such as homes and restaurants. Topics include perception (including approaches based on deep learning and approaches based on 3D geometry), planning (robot kinematics and trajectory generation, collision-free motion planning, task-and-motion planning, and planning under uncertainty), as well as dynamics and control (both model-based and learning-based. Students taking graduate version complete additional assignments.","T. P. Lozano-Perez, R. Tedrake",Robotics,G
6.8200,Sensorimotor Learning,6.3900 or 6.7900,G (Spring),3-0-9 units,,"Provides an in-depth view of the state-of-the-art learning methods for control and the know-how of applying these techniques. Topics span reinforcement learning, self-supervised learning, imitation learning, model-based learning, and advanced deep learning architectures, and specific machine learning challenges unique to building sensorimotor systems. Discusses how to identify if learning-based control can help solve a particular problem, how to formulate the problem in the learning framework, and what algorithm to use. Applications of algorithms in robotics, logistics, recommendation systems, playing games, and other control domains covered. Instruction involves two lectures a week, practical experience through exercises, discussion of current research directions, and a group project.",P. Agrawal,Robotics,G
6.8210,Underactuated Robotics,18.03 and 18.06,G (Spring),3-0-9 units,,"Covers nonlinear dynamics and control of underactuated mechanical systems, with an emphasis on computational methods. Topics include the nonlinear dynamics of robotic manipulators, applied optimal and robust control and motion planning. Discussions include examples from biology and applications to legged locomotion, compliant manipulation, underwater robots, and flying machines.",R. Tedrake,Robotics,G
6.4400,Computer Graphics,6.1010 and ( 18.06 or 18.C06[J] ),Acad Year 2024-2025: Not offered Acad Year 2025-2026: U (Fall),3-0-9 units,,"Introduction to computer graphics algorithms, software and hardware. Topics include ray tracing, the graphics pipeline, transformations, texture mapping, shadows, sampling, global illumination, splines, animation and color.","F. P. Durand, M. Konakovic-Lukovic, W. Matusik, J. Solomon",Graphics,U
6.4420[J],Computational Design and Fabrication,Calculus II (GIR) and ( 6.1010 or permission of instructor),U (Spring),3-0-9 units,,"Introduces computational aspects of computer-aided design and manufacturing. Explores relevant methods in the context of additive manufacturing (e.g., 3D printing). Topics include computer graphics (geometry modeling, solid modeling, procedural modeling), physically-based simulation (kinematics, finite element method), 3D scanning/geometry processing, and an overview of 3D fabrication methods. Exposes students to the latest research in computational fabrication. Students taking the graduate version complete additional assignments.",W. Matusik,Graphics,U
6.8410,Shape Analysis,"Calculus II (GIR) , 18.06 , and ( 6.8300 or 6.4400 )",Acad Year 2024-2025: G (Spring) Acad Year 2025-2026: Not offered,3-0-9 units,,"Introduces mathematical, algorithmic, and statistical tools needed to analyze geometric data and to apply geometric techniques to data analysis, with applications to fields such as computer graphics, machine learning, computer vision, medical imaging, and architecture. Potential topics include applied introduction to differential geometry, discrete notions of curvature, metric embedding, geometric PDE via the finite element method (FEM) and discrete exterior calculus (DEC),; computational spectral geometry and relationship to graph-based learning, correspondence and mapping, level set method, descriptor, shape collections, optimal transport, and vector field design.",J. Solomon,Graphics,G
6.8420,Computational Design and Fabrication,Calculus II (GIR) and ( 6.1010 or permission of instructor),G (Spring),3-0-9 units,,"Introduces computational aspects of computer-aided design and manufacturing. Explores relevant methods in the context of additive manufacturing (e.g., 3D printing). Topics include computer graphics (geometry modeling, solid modeling, procedural modeling), physically-based simulation (kinematics, finite element method), 3D scanning/geometry processing, and an overview of 3D fabrication methods. Exposes students to the latest research in computational fabrication. Students taking graduate version complete additional assignments.",W. Matusik,Graphics,G
6.4510,Engineering Interactive Technologies,"6.1020 , 6.2050 , 6.2060 , 6.9010 , or permission of instructor",U (Fall) Not offered regularly; consult department,1-5-6 units,,"Provides instruction in building cutting-edge interactive technologies, explains the underlying engineering concepts, and shows how those technologies evolved over time. Students use a studio format (i.e., extended periods of time) for constructing software and hardware prototypes. Topics include interactive technologies, such as multi-touch, augmented reality, haptics, wearables, and shape-changing interfaces. In a group project, students build their own interactive hardware/software prototypes and present them in a live demo at the end of term. Enrollment may be limited.",S. Mueller,Human-Computer Interaction & Society,U
6.4530[J],Principles and Practice of Assistive Technology,Permission of instructor,U (Fall) Not offered regularly; consult department,2-4-6 units,,"Students work closely with people with disabilities to develop assistive and adaptive technologies that help them live more independently. Covers design methods and problem-solving strategies; human factors; human-machine interfaces; community perspectives; social and ethical aspects; and assistive technology for motor, cognitive, perceptual, and age-related impairments. Prior knowledge of one or more of the following areas useful: software; electronics; human-computer interaction; cognitive science; mechanical engineering; control; or MIT hobby shop, MIT PSC, or other relevant independent project experience. Enrollment may be limited.","R. C. Miller, J. E. Greenberg, J. J. Leonard",Human-Computer Interaction & Society,U
6.4550[J],Interactive Music Systems,( 6.1010 and 21M.301 ) or permission of instructor,"U (Fall, Spring)",3-0-9 units. HASS-A,,See description under subject 21M.385[J] . Limited to 36.,"E. Egozy, L. Kaelbling",Human-Computer Interaction & Society,U
6.4570[J],Creating Video Games,6.100A or CMS.301,U (Fall),3-3-6 units. HASS-A,,See description under subject CMS.611[J] . Limited to 36.,"P. Tan, S. Verrilli, R. Eberhardt",Human-Computer Interaction & Society,U
6.4590[J],Foundations of Information Policy,Permission of instructor,Acad Year 2024-2025: U (Fall) Acad Year 2025-2026: Not offered,3-0-9 units. HASS-S,,"Studies the growth of computer and communications technology and the new legal and ethical challenges that reflect tensions between individual rights and societal needs. Topics include computer crime; intellectual property restrictions on software; encryption, privacy, and national security; academic freedom and free speech. Students meet and question technologists, activists, law enforcement agents, journalists, and legal experts. Instruction and practice in oral and written communication provided. Students taking graduate version complete additional assignments. Enrollment limited.","H. Abelson, M. Fischer, D. Weitzner",Human-Computer Interaction & Society,U
6.8510,Intelligent Multimodal User Interfaces,( 6.1020 and 6.4100 ) or permission of instructor,G (Spring),3-0-9 units,,"Implementation and evaluation of intelligent multi-modal user interfaces, taught from a combination of hands-on exercises and papers from the original literature. Topics include basic technologies for handling speech, vision, pen-based interaction, and other modalities, as well as various techniques for combining modalities. Substantial readings and a term project, where students build a program that illustrates one or more of the themes of the course.",R. Davis,Human-Computer Interaction & Society,G
6.8530,Interactive Data Visualization,6.1020,G (Spring) Not offered regularly; consult department,3-0-9 units,"Credit cannot also be received for 6.C35[J] , 6.C85[J] , 11.154 , 11.454 , 11.C35[J] , 11.C85[J]","Interactive visualization provides a means of making sense of a world awash in data. Covers the techniques and algorithms for creating effective visualizations, using principles from graphic design, perceptual psychology, and cognitive science. Short assignments build familiarity with the data analysis and visualization design process, and a final project provides experience designing, implementing, and deploying an explanatory narrative visualization or visual analysis tool to address a concrete challenge.",A. Satyanarayan,Human-Computer Interaction & Society,G
6.4710[J],"Evolutionary Biology: Concepts, Models and Computation",( 6.100A and 7.03 ) or permission of instructor,Acad Year 2024-2025: Not offered Acad Year 2025-2026: U (Spring),3-0-9 units,,See description under subject 7.33[J] .,"R. Berwick, D. Bartel",Computational Biology,U
6.8700[J],"Advanced Computational Biology: Genomes, Networks, Evolution","( Biology (GIR) , 6.1210 , and 6.3700 ) or permission of instructor",G (Fall),4-0-8 units,,"See description for 6.8701 . Additionally examines recent publications in the areas covered, with research-style assignments. A more substantial final project is expected, which can lead to a thesis and publication.",M. Kellis,Computational Biology,G
6.8701,"Computational Biology: Genomes, Networks, Evolution","( Biology (GIR) , 6.1210 , and 6.3700 ) or permission of instructor",U (Fall),3-0-9 units,,"Covers the algorithmic and machine learning foundations of computational biology, combining theory with practice. Principles of algorithm design, influential problems and techniques, and analysis of large-scale biological datasets. Topics include (a) genomes: sequence analysis, gene finding, RNA folding, genome alignment and assembly, database search; (b) networks: gene expression analysis, regulatory motifs, biological network analysis; (c) evolution: comparative genomics, phylogenetics, genome duplication, genome rearrangements, evolutionary theory. These are coupled with fundamental algorithmic techniques including: dynamic programming, hashing, Gibbs sampling, expectation maximization, hidden Markov models, stochastic context-free grammars, graph clustering, dimensionality reduction, Bayesian networks.",M. Kellis,Computational Biology,U
