code,title,prereq,terms,hours,optional,description,instructor,section_head,offered_to
6.910B,Design Thinking and Innovation Project,6.910A,"U (Fall, Spring; partial term)",2-0-1 units,,"Project-based subject. Students employ design-thinking techniques learned in 6.902A to develop a robust speech-recognition application using a web-based platform. Students practice in leadership and teamwork skills as they collaboratively conceive, implement, and iteratively refine their designs based on user feedback. Topics covered include techniques for leading the creative process in teams, the ethics of engineering systems, methods for articulating designs with group collaboration, identifying and reconciling paradoxes of engineering designs, and communicating solution concepts with impact. Students present oral presentations and receive feedback to sharpen their communication skills.",B. Kotelly,Gordon Engineering Leadership Program,U
6.9110,Engineering Leadership Lab,None. Coreq: 6.9120 ; or permission of instructor,"U (Fall, Spring)",0-2-1 units,Can be repeated for credit.,See description under subject 6.9130 . Preference to students enrolled in the Bernard M. Gordon-MIT Engineering Leadership Program.,"L. McGonagle, J. Feiler",Gordon Engineering Leadership Program,U
6.9120,Engineering Leadership,None. Coreq: 6.9110 ; or permission of instructor,"U (Fall, Spring)",1-0-2 units,Can be repeated for credit.,"Exposes students to the models and methods of engineering leadership within the contexts of conceiving, designing, implementing and operating products, processes and systems. Introduces the Capabilities of Effective Engineering Leaders, and models and theories related to the capabilities. Discusses the appropriate times and reasons to use particular models to deliver engineering success. Includes occasional guest speakers or panel discussions. May be repeated for credit once with permission of instructor. Preference to first-year students in the Gordon Engineering Leadership Program.",J. Magarian,Gordon Engineering Leadership Program,U
6.9130,Engineering Leadership Lab,"6.910A , 6.9110 , 6.9120 , or permission of instructor","U (Fall, Spring)",0-2-4 units,Can be repeated for credit.,"Advances students' leadership, teamwork, and communication skills through further exposure to leadership frameworks, models, and cases within an engineering context in an interactive, practice-based environment. Students coach others, assess performance, and lead guided reflections on individual and team successes, while discovering opportunities for improvement. Students assist with programmatic planning and implementation of role-play simulations, small group discussions, and performance and peer assessments by and of other students and by instructors. Includes frequent engineering industry-guest participation and involvement. Content is frequently student-led. Second year Gordon Engineering Leadership Program (GEL) Program students register for 6.9130 . Preference to students enrolled in the second year of the Gordon-MIT Engineering Leadership Program.","L. McGonagle, J. Feiler",Gordon Engineering Leadership Program,U
6.9140,Project Engineering,( 6.910A and ( 6.9110 or 6.9120 )) or permission of instructor,U (IAP),4-0-0 units,,"Students attend and participate in a four-day off-site workshop covering an introduction to basic principles, methods, and tools for project management in a realistic context. In teams, students create a plan for a project of their choice in one of several areas, including: aircraft modification, factory automation, flood prevention engineering, solar farm engineering, small-business digital transformation/modernization, and disaster response, among others. Develops skills applicable to the planning and management of complex engineering projects. Topics include cost-benefit analysis, resource and cost estimation, and project control and delivery which are practiced during an experiential, team-based activity. Case studies highlight projects in both hardware/software and consumer packaged goods. Preference to students in the Bernard M. Gordon-MIT Engineering Leadership Program.","O. de Weck, J. Feiler, L. McGonagle, R. Rahaman",Gordon Engineering Leadership Program,U
6.9150[J],Leading Innovation in Teams,,U (Spring) Not offered regularly; consult department,3-0-6 units,,"Empowers future innovators in engineering and technology with a foundation of leadership and teamwork skills. Grounded in research but practical in focus, equips students with leadership competencies such as building self-awareness, motivating and developing others, influencing without authority, managing conflict, and communicating effectively. Teamwork skills include how to convene, launch, and develop various types of teams, including project teams. Reviews recent advances in implementing innovations and building personal capacity for lifelong learning as a leading innovator. Enrollment limited to seating capacity of classroom. Admittance may be controlled by lottery.","D. Nino, J. Schindall",Gordon Engineering Leadership Program,U
6.9160[J],Engineering Innovation: Global Security Systems,,U (Spring),3-3-6 units,,See description under subject 15.359[J] .,G. Keselman,Gordon Engineering Leadership Program,U
6.9260,Multistakeholder Negotiation for Technical Experts,,G (Spring),2-0-4 units,,"Presents strategies and proven techniques for improving communications, relationships, and decision-making in groups using simulations, role-plays, case studies, and video analysis. Aims to provide the skill set needed to effectively negotiate with both internal and external stakeholders to align efforts and overcome differences. No prior experience in negotiation required. Satisfies the requirements for the Graduate Certificate in Technical Leadership.",S. Dinnar,Gordon Engineering Leadership Program,G
6.9270,Negotiation and Influence Skills for Technical Leaders,,G (Fall),2-0-4 units,,"Focuses around the premise that the abilities to negotiate with, and influence others, are essential to being an effective leader in technology rich environments. Provides graduate students with underlying principles and a repertoire of negotiation and influence skills that apply to interpersonal situations, particularly those where an engineer or project leader lacks formal authority over others in delivering results. Utilizes research-based approaches through the application of multiple learning methods, including experiential role plays, case studies, assessments, feedback, and personal reflections. Concepts such as the zone of possible agreements, best alternative to negotiated agreements, and sources of influence are put into practice. Satisfies the requirements for the Graduate Certificate in Technical Leadership.",R. M. Best,Gordon Engineering Leadership Program,G
6.9280[J],Leading Creative Teams,Permission of instructor,"G (Fall, Spring)",3-0-6 units,,"Prepares students to lead teams charged with developing creative solutions in engineering and technical environments. Grounded in research but practical in focus, equips students with leadership competencies such as building self-awareness, motivating and developing others, creative problem solving, influencing without authority, managing conflict, and communicating effectively. Teamwork skills include how to convene, launch, and develop various types of teams, including project teams. Learning methods emphasize personalized and experiential skill development. Enrollment limited.",D. Nino,Gordon Engineering Leadership Program,G
6.EPE,UPOP Engineering Practice Experience,,"U (Fall, Spring)",0-0-1 units,Can be repeated for credit.,See description under subject 2.EPE . Application required; consult UPOP website for more information.,"K. Tan-Tiongco, D. Fordell",Gordon Engineering Leadership Program,U
6.EPW,UPOP Engineering Practice Workshop,2.EPE,"U (Fall, IAP, Spring)",1-0-0 units,,See description under subject 2.EPW . Enrollment limited to those in the UPOP program.,"K. Tan-Tiongco, D. Fordell",Gordon Engineering Leadership Program,U
6.9302[J],StartMIT: Exploring Entrepreneurship and Innovation,,G (IAP),4-0-2 units,,"Designed for students who are interested in entrepreneurship. Introduces practices for building a successful company, such as idea creation and validation, defining a value proposition, building a team, marketing, customer traction, and possible funding models.","S. Neal, D. Ruiz Massieu",EECS & Beyond,G
6.9310,"Patents, Copyrights, and the Law of Intellectual Property",,U (Fall) Not offered regularly; consult department,2-0-4 units,,"Intensive introduction to the law, focusing on intellectual property, patents, copyrights, trademarks, and trade secrets. Covers the process of drafting and filing patent applications, enforcement of patents in the courts, the differences between US and international IP laws and enforcement mechanisms, and the inventor's ability to monetize and protect his/her innovations. Highlights current legal issues and trends relating to the technology, and life sciences industries. Readings include judicial opinions and statutory material. Class projects include patent drafting, patent searching, and patentability opinions, and courtroom presentation.",S. M. Bauer,EECS & Beyond,U
6.9320,Ethics for Engineers,,"U (Fall, Spring)",2-0-4 units,,See description under subject 10.01 .,"D. A. Lauffenburger, B. L. Trout",EECS & Beyond,U
6.9321,Ethics for Engineers - Independent Inquiry,,U (Fall) Not offered regularly; consult department,2-0-10 units,,"Explores the ethical principles by which an engineer ought to be guided. Integrates foundational texts in ethics with case studies illustrating ethical problems arising in the practice of engineering. Readings from classic sources including Aristotle, Kant, Machiavelli, Hobbes, Locke, Rousseau, Franklin, Tocqueville, Arendt, and King. Case studies include articles and films that address engineering disasters, safety, biotechnology, the internet and AI, and the ultimate scope and aims of engineering. Different sections may focus on themes, such as AI or biotechnology. To satisfy the independent inquiry component of this subject, students expand the scope of their term project. Students taking 20.005 focus their term project on a problem in biological engineering in which there are intertwined ethical and technical issues.","D. A. Lauffenburger, B. L. Trout",EECS & Beyond,U
6.9350[J],Financial Market Dynamics and Human Behavior,"15.401 , 15.414 , or 15.415",G (Spring),4-0-5 units,,See description under subject 15.481[J] . Enrollment may be limited; preference to Sloan graduate students.,A. Lo,EECS & Beyond,G
6.9360,Management in Engineering,,U (Fall),3-1-8 units,,See description under subject 2.96 . Restricted to juniors and seniors.,"H. S. Marcus, J.-H. Chun",EECS & Beyond,U
6.9500,Introduction to MATLAB,,U (IAP) Not offered regularly; consult department,1-0-2 units,,"Accelerated introduction to MATLAB and its popular toolboxes. Lectures are interactive, with students conducting sample MATLAB problems in real time. Includes problem-based MATLAB assignments. Students must provide their own laptop and software. Enrollment limited.",Staff,Independent Activities Period,U
6.9510,"Introduction to Signals and Systems, and Feedback Control",Calculus II (GIR) or permission of instructor,U (IAP) Not offered regularly; consult department,2-2-2 units,,"Introduces fundamental concepts for 6.003, including Fourier and Laplace transforms, convolution, sampling, filters, feedback control, stability, and Bode plots. Students engage in problem solving, using Mathematica and MATLAB software extensively to help visualize processing in the time frequency domains.",Staff,Independent Activities Period,U
6.9520,Introduction to Electrical Engineering Lab Skills,,U (IAP) Not offered regularly; consult department,1-3-2 units,,"Introduces basic electrical engineering concepts, components, and laboratory techniques. Covers analog integrated circuits, power supplies, and digital circuits. Lab exercises provide practical experience in constructing projects using multi-meters, oscilloscopes, logic analyzers, and other tools. Includes a project in which students build a circuit to display their own EKG. Enrollment limited.",G. P. Hom,Independent Activities Period,U
6.9550,Structure and Interpretation of Computer Programs,,U (IAP) Not offered regularly; consult department,1-0-5 units,,Studies the structure and interpretation of computer programs which transcend specific programming languages. Demonstrates thought patterns for computer science using Scheme. Includes weekly programming projects. Enrollment may be limited.,Staff,Independent Activities Period,U
6.9560,Introduction to Software Engineering in Java,,U (IAP) Not offered regularly; consult department,1-1-4 units,,"Covers the fundamentals of Java, helping students develop intuition about object-oriented programming. Focuses on developing working software that solves real problems. Designed for students with little or no programming experience. Concepts covered useful to 6.3100 . Enrollment limited.",Staff,Independent Activities Period,U
6.9570,Introduction to C and C++,,U (IAP) Not offered regularly; consult department,3-3-0 units,,"Fast-paced introduction to the C and C++ programming languages. Intended for those with experience in other languages who have never used C or C++. Students complete daily assignments, a small-scale individual project, and a mandatory online diagnostic test. Enrollment limited.",Staff,Independent Activities Period,U
6.9600,Mobile Autonomous Systems Laboratory: MASLAB,,U (IAP),2-2-2 units,Can be repeated for credit.,"Autonomous robotics contest emphasizing technical AI, vision, mapping and navigation from a robot-mounted camera. Few restrictions are placed on materials, sensors, and/or actuators enabling teams to build robots very creatively. Teams should have members with varying engineering, programming and mechanical backgrounds. Culminates with a robot competition at the end of IAP. Enrollment limited.",Staff,Independent Activities Period,U
6.9610,The Battlecode Programming Competition,,U (IAP),2-0-4 units,Can be repeated for credit.,"Artificial Intelligence programming contest in Java. Student teams program virtual robots to play Battlecode, a real-time strategy game. Competition culminates in a live BattleCode tournament. Assumes basic knowledge of programming.",Staff,Independent Activities Period,U
6.9620,Web Lab: A Web Programming Class and Competition,,U (IAP),1-0-5 units,Can be repeated for credit.,"Student teams learn to build a functional and user-friendly website. Topics include version control, HTML, CSS, JavaScript, ReactJS, and nodejs. All teams are eligible to enter a competition where sites are judged by industry experts. Beginners and experienced web programmers welcome, but some previous programming experience is recommended. Registration on subject website required.",Staff,Independent Activities Period,U
6.9630,Pokerbots Competition,,U (IAP),1-0-5 units,Can be repeated for credit.,"Build autonomous poker players and aquire the knowledge of the game of poker. Showcase decision making skills, apply concepts in mathematics, computer science and economics. Provides instruction in programming, game theory, probability and statistics and machine learning. Concludes with a final competition and prizes. Enrollment limited.",Staff,Independent Activities Period,U
6.9700,Studies in Artificial Intelligence and Decision Making,Permission of department,G (Fall) Not offered regularly; consult department,0-0-48 units,,"Introduction to artificial intelligence and decision making in a series of online subjects followed by a comprehensive examination. Probability: distributions and probabilistic calculations, inference methods, laws of large numbers, and random processes. Statistical data analysis: linear regression, parameter estimation, hypothesis testing, model selection, and causal inference. Machine learning: linear classification, fundamentals of supervised machine learning, deep learning, unsupervised learning, and generative models. Online decision making: online optimization, online learning, Markov decision processes and reinforcement learning, elements of control theory, and fundamentals of game theory.  Computer vision: fundamentals of image and signal processing, introduction to machine learning for vision, generative models and representation learning, and elements of scene understanding. Restricted to Artificial Intelligence and Decision Making MicroMasters Credential holders in the AI+D Blended Master's program.","A. Madry, P. Parrilo",Non-classroom & Career,G
6.9710,Internship in Artificial Intelligence and Decision Making,Permission of department,"G (Spring, Summer)",Units arranged [P/D/F],,Provides an opportunity for students to synthesize their coursework and to apply the knowledge gained in the program towards a project with a host organization. All internship placements are subject to approval by program director. Each student must write a capstone project report. Restricted to students in the AI+D blended master's program.,"A. Madry, P. Parrilo",Non-classroom & Career,G
6.9720,Research in Artificial Intelligence and Decision Making,Permission of department,"Acad Year 2024-2025: Not offered Acad Year 2025-2026: G (Spring, Summer)",0-0-12 units,,Individual research project arranged with appropriate faculty member or approved advisor. A final paper summarizing research is required. Restricted to students in the AI+D blended SM program.,"A. Madry, P. Parrilo",Non-classroom & Career,G
6.9800,Independent Study in Electrical Engineering and Computer Science,Permission of instructor,"U (Fall, IAP, Spring, Summer)",Units arranged [P/D/F],Can be repeated for credit.,Opportunity for independent study at the undergraduate level under regular supervision by a faculty member. Study plans require prior approval.,Consult Department Undergraduate Office,Non-classroom & Career,U
6.9820,Practical Internship Experience,,"U (Fall, IAP, Spring, Summer)",0-1-0 units,Can be repeated for credit.,"For Course 6 students participating in curriculum-related off-campus internship experiences in electrical engineering or computer science. Before enrolling, students must have an employment offer from a company or organization and must find an EECS advisor. Upon completion of the internship the student must submit a letter from the employer evaluating the work accomplished, a substantive final report from the student, approved by the MIT advisor. Subject to departmental approval. Consult Department Undergraduate Office for details on procedures and restrictions.",Consult Department Undergraduate Office,Non-classroom & Career,U
6.9830,Professional Perspective Internship,,"G (Fall, IAP, Spring, Summer)",0-1-0 units,,"Required for Course 6 MEng students to gain professional experience in electrical engineering or computer science through an internship (industry, government, or academic) of 4 or more weeks in IAP or summer. This can be completed as MEng students or as undergrads, through previous employment completed while deferring MEng entry or by attending a series of three colloquia, seminars, or technical talks related to their field. For internships/work experience, a letter from the employer confirming dates of employment is required. All students are required to write responses to short essay prompts about their professional experience. International students must consult ISO and the EECS Undergraduate Office on work authorization and allowable employment dates.",Consult Department Undergraduate Office,Non-classroom & Career,G
6.9840,Practical Experience in EECS,,"G (Fall, IAP, Spring, Summer)",0-1-0 units,Can be repeated for credit.,"For Course 6 students in the MEng program who seek practical off-campus research experiences or internships in electrical engineering or computer science. Before enrolling, students must have an offer of employment from a company or organization and secure an advisor within EECS. Employers must document the work accomplished. Proposals subject to departmental approval. For students who begin the MEng program in the summer only, the experience or internship cannot exceed 20 hours per week and must begin no earlier than the first day of the Summer Session, but may end as late as the last business day before the Fall Term.",Consult Department Undergraduate Office,Non-classroom & Career,G
6.9850,6-A Internship,,"U (Fall, Spring, Summer)",0-12-0 units,,Provides academic credit for the first assignment of 6-A undergraduate students at companies affiliated with the department's 6-A internship program. Limited to students participating in the 6-A internship program.,T. Palacios,Non-classroom & Career,U
6.9860,Advanced 6-A Internship,6.9850,"U (Fall, Spring, Summer)",0-12-0 units,,Provides academic credit for the second assignment of 6-A undergraduate students at companies affiliated with the department's 6-A internship program. Limited to students participating in the 6-A internship program.,T. Palacios,Non-classroom & Career,U
6.9870,Graduate 6-A Internship,6.9850 or 6.9860,"G (Fall, Spring, Summer)",0-12-0 units,,Provides academic credit for a graduate assignment of graduate 6-A students at companies affiliated with the department's 6-A internship program. Limited to graduate students participating in the 6-A internship program.,T. Palacios,Non-classroom & Career,G
6.9880,Graduate 6-A Internship,6.9870,"G (Fall, Spring, Summer)",0-12-0 units,,Provides academic credit for graduate students in the second half of their 6-A MEng industry internship. Limited to graduate students participating in the 6-A internship program.,T. Palacios,Non-classroom & Career,G
6.9900,Teaching Electrical Engineering and Computer Science,,"G (Fall, Spring)",Units arranged [P/D/F],Can be repeated for credit.,"For Teaching Assistants in Electrical Engineering and Computer Science, in cases where teaching assignment is approved for academic credit by the department.","E. Adalsteinsson, D. M. Freeman, L. P. Kaelbling, R. C. Miller",Non-classroom & Career,G
6.9910,Research in Electrical Engineering and Computer Science,,"G (Fall, Spring, Summer)",Units arranged [P/D/F],Can be repeated for credit.,"For EECS MEng students who are Research Assistants in Electrical Engineering and Computer Science, in cases where the assigned research is approved for academic credit by the department. Hours arranged with research advisor.",Consult Department Undergraduate Office,Non-classroom & Career,G
6.9920,Introductory Research in Electrical Engineering and Computer Science,Permission of instructor,"G (Fall, Spring, Summer)",Units arranged [P/D/F],Can be repeated for credit.,"Enrollment restricted to first-year graduate students in Electrical Engineering and Computer Science who are doing introductory research leading to an SM, EE, ECS, PhD, or ScD thesis. Opportunity to become involved in graduate research, under guidance of a staff member, on a problem of mutual interest to student and advisor. Individual programs subject to approval of professor in charge.",L. A. Kolodziejski,Non-classroom & Career,G
6.9930,Networking Seminars in EECS,,G (Fall),Units arranged [P/D/F],,"For first year Course 6 students in the SM/PhD track, who seek weekly engagement with departmental faculty and staff, to discuss topics related to the graduate student experience, and to promote a successful start to graduate school.",J. Fischer,Non-classroom & Career,G
6.9932,Introduction to Research in Electrical Engineering and Computer Science,Permission of instructor,"G (Fall, Spring, Summer)",3-0-0 units,,"Seminar on topics related to research leading to an SM, EE, ECS, PhD, or ScD thesis. Limited to first-year regular graduate students in EECS with a fellowship or teaching assistantship.",L. A. Kolodziejski,Non-classroom & Career,G
6.9940,Professional Perspective I,,"G (Fall, IAP, Spring, Summer)",0-0-1 units,Can be repeated for credit.,"Required for Course 6 students in the doctoral program to gain professional perspective in research experiences, academic experiences, and internships in electrical engineering and computer science. Professional perspective options include: internships (with industry, government or academia), industrial colloquia or seminars, research collaboration with industry or government, and professional development for entry into academia or entrepreneurial engagement. For an internship experience, an offer of employment from a company or organization is required prior to enrollment; employers must document work accomplished. A written report is required upon completion of a minimum of 4 weeks of off-campus experiences. Proposals subject to departmental approval.",Consult Department Graduate Office,Non-classroom & Career,G
6.9950,Professional Perspective II,6.9940,"G (Fall, IAP, Spring, Summer)",0-0-1 units,Can be repeated for credit.,"Required for Course 6 students in the doctoral program to gain professional perspective in research experiences, academic experiences, and internships in electrical engineering and computer science. Professional perspective options include: internships (with industry, government or academia), industrial colloquia or seminars, research collaboration with industry or government, and professional development for entry into academia or entrepreneurial engagement. For an internship experience, an offer of employment from a company or organization is required prior to enrollment; employers must document work accomplished. A written report is required upon completion of a minimum of 4 weeks of off-campus experiences. Proposals subject to departmental approval.",Consult Department Graduate Office,Non-classroom & Career,G
